id,name,required_skills,posted
1039,SteelWorks Inc.,"tiles, pouring, finishing, budgeting",2025-07-22
1040,UrbanGrid Energy,"leadership, maintenance, green building, project management, drywall",2025-07-28
1041,TilePro Solutions,"masonry, fabrication, safety, pouring",2025-06-03
1042,FixItAll,"circuits, masonry, tools",2025-06-23
1043,FixItAll,"multi-trade skills, repair, pipe fitting",2025-07-24
1044,PowerFix Ltd,"carpentry, pipe fitting, masonry, HV lines, framing",2025-07-30
1045,PowerFix Ltd,"metal cutting, electric systems, safety",2025-07-05
1046,ABC Constructions,"electric systems, masonry, carpentry, leadership",2025-07-23
1047,SteelWorks Inc.,"repair, welding, drywall",2025-06-11
1048,PowerFix Ltd,"electric systems, masonry, energy efficiency",2025-06-27
1049,FixItAll,"HV lines, design, budgeting, green building, welding",2025-06-18
1050,GreenBuild Tech,"finishing, metal cutting, repair, energy efficiency, plumbing",2025-07-21
1051,QuickBuild,"leadership, pouring, solar panels, pipe fitting",2025-07-30
1052,QuickBuild,"water systems, drywall, metal cutting, waterproofing, tools",2025-06-30
1053,SafeElectro,"fabrication, project management, pouring",2025-07-23
1054,SteelWorks Inc.,"concrete mixing, circuits, installation, pipe fitting, drywall",2025-06-05
1055,ABC Constructions,"circuits, metal cutting, inspection, multi-trade skills",2025-07-05
1056,MegaConstruct,"design, repair, energy efficiency, masonry",2025-06-13
1057,PowerFix Ltd,"insulation, blueprint reading, green building, leadership, tools",2025-07-17
1058,SafeElectro,"project management, maintenance, HV lines, waterproofing, finishing",2025-07-08
1059,MegaConstruct,"construction, tools, concrete mixing, project management",2025-06-25
1060,UrbanGrid Energy,"blueprint reading, plumbing, pouring, project management",2025-06-12
1061,MegaConstruct,"water systems, electrician, circuits, inspection, carpentry",2025-06-02
1062,GreenBuild Tech,"installation, HV lines, masonry, electrician",2025-06-16
1063,ConcreteMasters,"installation, project management, metal cutting, water systems, finishing",2025-06-04
1064,PowerLine Engineers,"tiles, welding, design",2025-07-03
1065,TilePro Solutions,"water systems, insulation, project management, drywall, leadership",2025-06-10
1066,MegaConstruct,"repair, blueprint reading, drywall",2025-07-06
1067,FreshCo Homes,"masonry, electrician, solar panels, electric systems, green building",2025-06-13
1068,QuickBuild,"testing, energy efficiency, concrete mixing, finishing",2025-06-26
1069,SteelWorks Inc.,"masonry, water systems, fabrication",2025-07-31
1070,PowerLine Engineers,"green building, circuits, electric systems, electrician, construction",2025-07-03
1071,QuickBuild,"repair, electrician, reinforcement, framing, fabrication",2025-07-19
1072,UrbanGrid Energy,"carpentry, pipe fitting, construction, green building",2025-06-23
1073,PowerFix Ltd,"inspection, pipe fitting, concrete mixing, waterproofing, tiles",2025-06-07
1074,PlumbWell Services,"HV lines, finishing, pouring, water systems",2025-07-03
1075,QuickBuild,"design, water systems, HV lines, circuit design",2025-06-02
1076,ABC Constructions,"pouring, tiles, safety, inspection, circuit design",2025-07-28
1077,ABC Constructions,"design, carpentry, concrete mixing, multi-trade skills",2025-06-12
1078,FreshCo Homes,"solar panels, masonry, pouring, circuit design",2025-07-16
1079,PowerFix Ltd,"drywall, framing, reinforcement",2025-07-10
1080,PowerFix Ltd,"inspection, waterproofing, design",2025-06-09
1081,FixItAll,"circuits, multi-trade skills, waterproofing",2025-06-11
1082,FreshCo Homes,"multi-trade skills, design, leadership, tools",2025-06-28
1083,QuickBuild,"circuit design, HV lines, installation, carpentry",2025-06-10
1084,QuickBuild,"drywall, repair, leadership, safety protocols",2025-06-15
1085,PowerLine Engineers,"pouring, design, tools, testing, HV lines",2025-07-14
1086,SafeElectro,"multi-trade skills, plumbing, waterproofing, fabrication",2025-06-07
1087,SteelWorks Inc.,"drywall, carpentry, blueprint reading",2025-06-27
1088,GreenBuild Tech,"masonry, framing, plumbing",2025-07-30
1089,TilePro Solutions,"framing, electrician, inspection",2025-06-10
1090,FixItAll,"insulation, solar panels, reinforcement",2025-07-22
1091,ConcreteMasters,"masonry, budgeting, tiles, HV lines, plumbing",2025-07-01
1092,SafeElectro,"carpentry, circuit design, drywall, multi-trade skills",2025-06-12
1093,PowerFix Ltd,"maintenance, design, repair",2025-07-11
1094,GreenBuild Tech,"insulation, installation, waterproofing",2025-06-26
1095,UrbanGrid Energy,"pipe fitting, design, repair, construction, maintenance",2025-07-07
1096,PowerLine Engineers,"waterproofing, metal cutting, welding, framing",2025-07-04
1097,BuildRight Co.,"metal cutting, fabrication, framing, pouring, reinforcement",2025-06-06
1098,ConcreteMasters,"plumbing, HV lines, budgeting",2025-07-22
1099,TilePro Solutions,"pipe fitting, maintenance, drywall, safety, electrician",2025-06-25
1100,BuildRight Co.,"multi-trade skills, HV lines, pipe fitting",2025-07-23
1101,MegaConstruct,"plumbing, energy efficiency, drywall, HV lines, safety",2025-07-17
1102,FixItAll,"construction, insulation, energy efficiency, plumbing, solar panels",2025-06-21
1103,FreshCo Homes,"inspection, HV lines, budgeting, green building, metal cutting",2025-07-19
1104,SafeElectro,"masonry, pipe fitting, framing, budgeting",2025-06-29
1105,FixItAll,"repair, electric systems, construction, electrician, masonry",2025-06-06
1106,UrbanGrid Energy,"construction, framing, multi-trade skills, testing",2025-07-06
1107,QuickBuild,"waterproofing, circuits, finishing, blueprint reading, masonry",2025-06-21
1108,BuildRight Co.,"circuit design, welding, leadership",2025-07-24
1109,PowerFix Ltd,"green building, water systems, HV lines",2025-07-21
1110,QuickBuild,"multi-trade skills, repair, insulation, green building",2025-06-23
1111,UrbanGrid Energy,"carpentry, pouring, reinforcement, finishing",2025-07-01
1112,UrbanGrid Energy,"tiles, pouring, construction, testing, green building",2025-07-14
1113,FixItAll,"pipe fitting, repair, water systems, HV lines, solar panels",2025-07-24
1114,SteelWorks Inc.,"finishing, pipe fitting, framing, electric systems, project management",2025-07-05
1115,PowerFix Ltd,"safety protocols, blueprint reading, concrete mixing, testing",2025-07-13
1116,GreenBuild Tech,"drywall, multi-trade skills, electric systems",2025-06-26
1117,FixItAll,"framing, solar panels, masonry, installation",2025-06-14
1118,FixItAll,"circuits, energy efficiency, budgeting, circuit design",2025-06-17
1119,UrbanGrid Energy,"leadership, construction, multi-trade skills",2025-06-15
1120,PowerLine Engineers,"design, carpentry, repair",2025-06-04
1121,TilePro Solutions,"energy efficiency, electrician, repair, multi-trade skills, green building",2025-06-02
1122,ABC Constructions,"framing, electrician, construction",2025-06-03
1123,FixItAll,"safety, HV lines, circuits",2025-07-14
1124,PowerFix Ltd,"plumbing, carpentry, fabrication",2025-06-14
1125,ABC Constructions,"metal cutting, tools, finishing",2025-06-11
1126,FreshCo Homes,"HV lines, budgeting, finishing",2025-06-23
1127,PowerFix Ltd,"circuits, testing, electric systems",2025-06-22
1128,FreshCo Homes,"green building, installation, HV lines",2025-06-23
1129,TilePro Solutions,"repair, pouring, welding",2025-07-29
1130,UrbanGrid Energy,"inspection, fabrication, water systems",2025-06-02
1131,ConcreteMasters,"water systems, fabrication, pipe fitting, leadership, testing",2025-06-21
1132,ABC Constructions,"installation, welding, finishing",2025-06-01
1133,SafeElectro,"circuits, repair, safety protocols",2025-06-18
1134,FreshCo Homes,"waterproofing, project management, construction, installation, plumbing",2025-07-16
1135,MegaConstruct,"framing, electric systems, electrician",2025-06-20
1136,FreshCo Homes,"fabrication, masonry, green building, electrician",2025-06-04
1137,QuickBuild,"fabrication, finishing, framing, drywall",2025-06-05
1138,MegaConstruct,"concrete mixing, fabrication, circuits, metal cutting, construction",2025-07-10
1139,SteelWorks Inc.,"repair, construction, water systems, energy efficiency, budgeting",2025-06-01
1140,GreenBuild Tech,"installation, maintenance, finishing",2025-06-14
1141,UrbanGrid Energy,"solar panels, metal cutting, leadership",2025-06-28
1142,ConcreteMasters,"safety protocols, tools, carpentry",2025-07-20
1143,UrbanGrid Energy,"design, finishing, leadership",2025-06-28
1144,MegaConstruct,"design, water systems, insulation",2025-07-12
1145,GreenBuild Tech,"repair, inspection, electrician",2025-07-01
1146,FreshCo Homes,"maintenance, reinforcement, concrete mixing, metal cutting",2025-06-05
1147,PowerFix Ltd,"electrician, reinforcement, drywall, circuits",2025-07-18
1148,MegaConstruct,"waterproofing, construction, pouring",2025-06-24
1149,FixItAll,"construction, installation, inspection",2025-07-25
1150,FreshCo Homes,"repair, green building, blueprint reading, finishing",2025-07-10
1151,PowerFix Ltd,"repair, masonry, circuits, HV lines, electric systems",2025-07-07
1152,BuildRight Co.,"construction, installation, plumbing, solar panels",2025-07-19
1153,PlumbWell Services,"project management, water systems, multi-trade skills, metal cutting, blueprint reading",2025-06-23
1154,ConcreteMasters,"maintenance, repair, blueprint reading, carpentry",2025-07-02
1155,GreenBuild Tech,"electric systems, drywall, repair",2025-07-18
1156,BuildRight Co.,"reinforcement, safety, masonry, circuit design",2025-06-15
1157,SafeElectro,"design, electric systems, tools, blueprint reading",2025-07-06
1158,PowerFix Ltd,"circuit design, pipe fitting, safety, blueprint reading, electric systems",2025-06-15
1159,SteelWorks Inc.,"reinforcement, multi-trade skills, safety",2025-07-31
1160,ConcreteMasters,"tools, drywall, budgeting, inspection",2025-06-30
1161,PowerLine Engineers,"safety, project management, budgeting, concrete mixing, repair",2025-07-26
1162,PowerFix Ltd,"reinforcement, installation, insulation",2025-07-26
1163,QuickBuild,"multi-trade skills, inspection, installation, carpentry, electrician",2025-07-09
1164,QuickBuild,"inspection, pipe fitting, tools",2025-07-17
1165,UrbanGrid Energy,"maintenance, concrete mixing, installation, reinforcement",2025-06-10
1166,GreenBuild Tech,"safety, energy efficiency, circuit design",2025-06-27
1167,TilePro Solutions,"carpentry, circuits, masonry",2025-07-28
1168,ABC Constructions,"framing, maintenance, design, leadership",2025-07-24
1169,QuickBuild,"HV lines, circuit design, concrete mixing",2025-06-07
1170,PlumbWell Services,"fabrication, leadership, testing",2025-07-04
1171,PowerLine Engineers,"inspection, carpentry, construction, water systems, solar panels",2025-06-25
1172,BuildRight Co.,"inspection, drywall, green building, design",2025-06-30
1173,SafeElectro,"HV lines, solar panels, carpentry, blueprint reading, drywall",2025-07-22
1174,GreenBuild Tech,"circuits, green building, design",2025-06-03
1175,SafeElectro,"plumbing, fabrication, safety",2025-06-17
1176,FixItAll,"inspection, design, safety, repair, solar panels",2025-06-09
1177,UrbanGrid Energy,"installation, water systems, pipe fitting",2025-06-16
1178,BuildRight Co.,"energy efficiency, metal cutting, carpentry, electrician",2025-06-02
1179,FreshCo Homes,"energy efficiency, blueprint reading, testing, drywall, framing",2025-06-23
1180,SteelWorks Inc.,"insulation, framing, pipe fitting, safety protocols, fabrication",2025-07-05
1181,QuickBuild,"budgeting, circuits, repair, drywall",2025-07-27
1182,GreenBuild Tech,"green building, framing, insulation, solar panels, inspection",2025-06-23
1183,FreshCo Homes,"repair, waterproofing, water systems",2025-06-17
1184,PowerFix Ltd,"carpentry, waterproofing, circuits, water systems, insulation",2025-07-01
1185,ConcreteMasters,"project management, blueprint reading, safety, circuit design, plumbing",2025-06-04
1186,SafeElectro,"HV lines, drywall, electric systems, welding, installation",2025-07-22
1187,ABC Constructions,"welding, masonry, fabrication",2025-06-08
1188,TilePro Solutions,"framing, multi-trade skills, leadership, electrician",2025-06-07
1189,UrbanGrid Energy,"carpentry, tiles, pouring",2025-06-05
1190,FreshCo Homes,"maintenance, budgeting, tiles, circuits, electrician",2025-06-06
1191,TilePro Solutions,"multi-trade skills, electric systems, finishing",2025-06-28
1192,MegaConstruct,"green building, electric systems, installation, masonry",2025-07-28
1193,UrbanGrid Energy,"reinforcement, testing, plumbing, budgeting",2025-06-16
1194,GreenBuild Tech,"safety protocols, budgeting, waterproofing, drywall, leadership",2025-07-30
1195,PowerFix Ltd,"framing, HV lines, testing, green building",2025-07-30
1196,ABC Constructions,"pipe fitting, HV lines, blueprint reading, electric systems",2025-06-08
1197,SteelWorks Inc.,"framing, pouring, insulation",2025-07-13
1198,FixItAll,"inspection, tools, circuit design, leadership",2025-06-07
1199,GreenBuild Tech,"pouring, project management, testing",2025-07-16
1200,QuickBuild,"solar panels, pipe fitting, drywall, leadership",2025-06-23
1201,MegaConstruct,"leadership, reinforcement, multi-trade skills, maintenance",2025-06-09
1202,SafeElectro,"reinforcement, budgeting, concrete mixing",2025-07-03
1203,ConcreteMasters,"pouring, tiles, circuit design, framing",2025-07-16
1204,ConcreteMasters,"masonry, water systems, maintenance",2025-07-25
1205,ABC Constructions,"concrete mixing, carpentry, circuit design, pipe fitting, project management",2025-06-17
1206,PlumbWell Services,"blueprint reading, safety protocols, framing, energy efficiency",2025-06-10
1207,BuildRight Co.,"circuit design, water systems, pipe fitting, electric systems, pouring",2025-06-25
1208,PowerLine Engineers,"circuits, safety protocols, multi-trade skills, blueprint reading",2025-07-15
1209,FreshCo Homes,"carpentry, repair, tiles, circuit design",2025-06-02
1210,PowerLine Engineers,"inspection, design, blueprint reading, repair",2025-07-22
1211,UrbanGrid Energy,"design, project management, finishing, water systems, drywall",2025-07-25
1212,ConcreteMasters,"welding, waterproofing, safety, blueprint reading",2025-06-08
1213,UrbanGrid Energy,"tiles, concrete mixing, water systems",2025-07-16
1214,ConcreteMasters,"concrete mixing, circuits, insulation, budgeting",2025-06-01
1215,SafeElectro,"masonry, inspection, tools, waterproofing",2025-07-20
1216,FixItAll,"multi-trade skills, circuit design, safety protocols, tiles",2025-07-28
1217,BuildRight Co.,"green building, testing, HV lines, welding",2025-06-13
1218,QuickBuild,"multi-trade skills, repair, safety, fabrication",2025-07-28
1219,QuickBuild,"solar panels, waterproofing, carpentry",2025-06-29
1220,GreenBuild Tech,"framing, circuit design, tiles, fabrication, solar panels",2025-07-12
1221,GreenBuild Tech,"electrician, pouring, tools, HV lines, design",2025-07-17
1222,FreshCo Homes,"plumbing, waterproofing, design, concrete mixing",2025-07-10
1223,SteelWorks Inc.,"maintenance, welding, reinforcement, masonry",2025-06-06
1224,PowerFix Ltd,"tools, framing, water systems, metal cutting",2025-07-19
1225,BuildRight Co.,"inspection, maintenance, pouring",2025-06-17
1226,MegaConstruct,"fabrication, framing, design, water systems, metal cutting",2025-06-09
1227,ABC Constructions,"green building, insulation, plumbing",2025-07-02
1228,MegaConstruct,"green building, circuits, HV lines, pipe fitting, circuit design",2025-06-26
1229,PowerFix Ltd,"energy efficiency, carpentry, solar panels, insulation",2025-07-29
1230,ABC Constructions,"finishing, metal cutting, budgeting, leadership, circuit design",2025-06-20
1231,QuickBuild,"circuits, blueprint reading, electric systems, plumbing, multi-trade skills",2025-06-01
1232,ABC Constructions,"plumbing, pipe fitting, project management",2025-06-22
1233,UrbanGrid Energy,"testing, metal cutting, construction, installation, electric systems",2025-07-27
1234,PowerFix Ltd,"tools, framing, masonry, concrete mixing, plumbing",2025-06-09
1235,FreshCo Homes,"design, electrician, concrete mixing",2025-07-16
1236,MegaConstruct,"carpentry, HV lines, reinforcement, budgeting",2025-07-02
1237,PowerFix Ltd,"testing, circuits, electrician, budgeting",2025-06-01
1238,GreenBuild Tech,"circuits, tiles, solar panels, electrician",2025-07-19
1239,PlumbWell Services,"multi-trade skills, masonry, energy efficiency",2025-07-08
1240,PowerLine Engineers,"fabrication, tiles, circuits, circuit design, construction",2025-06-27
1241,FixItAll,"plumbing, multi-trade skills, finishing, budgeting, electric systems",2025-07-09
1242,TilePro Solutions,"testing, drywall, installation, repair, tiles",2025-07-22
1243,BuildRight Co.,"circuits, repair, maintenance, insulation",2025-07-17
1244,UrbanGrid Energy,"carpentry, pouring, welding, project management, metal cutting",2025-07-15
1245,MegaConstruct,"pipe fitting, tools, project management, construction",2025-06-03
1246,PowerLine Engineers,"testing, tools, circuits, repair, welding",2025-07-08
1247,GreenBuild Tech,"circuits, concrete mixing, welding, solar panels, HV lines",2025-07-17
1248,QuickBuild,"tools, metal cutting, tiles, budgeting, drywall",2025-06-27
1249,BuildRight Co.,"concrete mixing, insulation, circuit design, construction",2025-07-01
1250,GreenBuild Tech,"installation, construction, electrician, electric systems, safety protocols",2025-06-22
1251,GreenBuild Tech,"waterproofing, electric systems, finishing",2025-07-03
1252,PowerLine Engineers,"inspection, leadership, finishing, blueprint reading, waterproofing",2025-07-27
1253,FixItAll,"green building, leadership, welding, carpentry, masonry",2025-07-20
1254,TilePro Solutions,"blueprint reading, plumbing, metal cutting, fabrication, safety",2025-07-25
1255,UrbanGrid Energy,"circuits, plumbing, tools, concrete mixing",2025-07-10
1256,PowerLine Engineers,"electrician, circuits, design, green building",2025-06-24
1257,PowerFix Ltd,"insulation, project management, concrete mixing",2025-07-19
1258,SafeElectro,"metal cutting, safety, welding, design",2025-06-19
1259,PowerLine Engineers,"construction, welding, green building",2025-06-14
1260,BuildRight Co.,"masonry, blueprint reading, inspection",2025-07-20
1261,SteelWorks Inc.,"repair, welding, construction",2025-06-24
1262,SteelWorks Inc.,"masonry, fabrication, framing",2025-06-25
1263,FixItAll,"carpentry, welding, tools",2025-07-09
1264,ConcreteMasters,"budgeting, blueprint reading, inspection, masonry",2025-06-19
1265,SafeElectro,"energy efficiency, water systems, safety",2025-06-21
1266,FreshCo Homes,"inspection, pipe fitting, concrete mixing, blueprint reading, multi-trade skills",2025-07-30
1267,PowerFix Ltd,"installation, HV lines, masonry, fabrication",2025-06-29
1268,GreenBuild Tech,"construction, metal cutting, electrician, HV lines",2025-06-02
1269,TilePro Solutions,"tools, masonry, construction, tiles",2025-07-02
1270,BuildRight Co.,"green building, plumbing, construction, design",2025-06-16
1271,ConcreteMasters,"circuit design, tiles, concrete mixing, masonry, energy efficiency",2025-06-28
1272,BuildRight Co.,"construction, inspection, HV lines, green building",2025-07-07
1273,ABC Constructions,"energy efficiency, design, pouring, carpentry",2025-07-28
1274,SteelWorks Inc.,"pouring, design, HV lines, construction",2025-07-06
1275,ConcreteMasters,"framing, tiles, leadership",2025-07-11
1276,PowerLine Engineers,"framing, solar panels, pouring, welding",2025-06-24
1277,MegaConstruct,"multi-trade skills, finishing, reinforcement, solar panels, testing",2025-07-26
1278,UrbanGrid Energy,"concrete mixing, testing, masonry, carpentry, circuits",2025-06-17
1279,PlumbWell Services,"carpentry, budgeting, tiles, leadership",2025-07-05
1280,FixItAll,"reinforcement, pouring, pipe fitting",2025-07-04
1281,QuickBuild,"green building, pouring, fabrication, safety protocols",2025-06-17
1282,UrbanGrid Energy,"tools, maintenance, carpentry",2025-06-04
1283,FixItAll,"insulation, reinforcement, repair",2025-06-03
1284,SteelWorks Inc.,"blueprint reading, HV lines, electrician, insulation",2025-06-11
1285,BuildRight Co.,"design, welding, pouring",2025-06-16
1286,QuickBuild,"carpentry, reinforcement, multi-trade skills, waterproofing, insulation",2025-07-29
1287,PowerFix Ltd,"testing, fabrication, inspection",2025-07-03
1288,FixItAll,"multi-trade skills, inspection, concrete mixing, metal cutting, safety protocols",2025-06-30
1289,ConcreteMasters,"inspection, testing, waterproofing, electrician, drywall",2025-06-26
1290,MegaConstruct,"finishing, concrete mixing, electric systems, fabrication",2025-07-14
1291,PowerLine Engineers,"inspection, HV lines, waterproofing",2025-07-08
1292,QuickBuild,"welding, electrician, green building, repair",2025-06-01
1293,TilePro Solutions,"budgeting, circuits, pouring, metal cutting",2025-06-10
1294,UrbanGrid Energy,"plumbing, drywall, green building, circuit design, HV lines",2025-07-02
1295,TilePro Solutions,"testing, safety, energy efficiency, drywall, pipe fitting",2025-07-28
1296,SteelWorks Inc.,"concrete mixing, drywall, pipe fitting, energy efficiency",2025-06-07
1297,SafeElectro,"tiles, concrete mixing, waterproofing, water systems, multi-trade skills",2025-07-17
1298,ConcreteMasters,"multi-trade skills, circuit design, waterproofing",2025-07-04
1299,TilePro Solutions,"pouring, tools, masonry, tiles, solar panels",2025-07-28
1300,SafeElectro,"electrician, solar panels, masonry",2025-06-23
1301,MegaConstruct,"budgeting, green building, design",2025-06-28
1302,GreenBuild Tech,"safety protocols, plumbing, waterproofing, tiles, fabrication",2025-07-16
1303,GreenBuild Tech,"safety, circuit design, tiles, leadership",2025-06-22
1304,ConcreteMasters,"pipe fitting, pouring, budgeting, tiles, design",2025-07-03
1305,SteelWorks Inc.,"masonry, circuits, water systems, maintenance, HV lines",2025-06-25
1306,SteelWorks Inc.,"water systems, pipe fitting, fabrication, electrician",2025-07-12
1307,FreshCo Homes,"drywall, pouring, circuit design, electrician",2025-07-24
1308,TilePro Solutions,"repair, electrician, finishing, testing, circuits",2025-06-04
1309,QuickBuild,"design, metal cutting, insulation",2025-06-20
1310,FixItAll,"insulation, project management, solar panels",2025-07-04
1311,SafeElectro,"testing, tiles, pouring, safety, safety protocols",2025-06-27
1312,PowerFix Ltd,"leadership, water systems, electrician",2025-06-06
1313,GreenBuild Tech,"energy efficiency, tools, reinforcement",2025-06-03
1314,TilePro Solutions,"waterproofing, masonry, construction, framing, safety protocols",2025-06-06
1315,ABC Constructions,"HV lines, construction, design",2025-06-16
1316,QuickBuild,"framing, carpentry, green building, circuits",2025-07-07
1317,FixItAll,"green building, drywall, budgeting",2025-06-17
1318,PlumbWell Services,"safety, multi-trade skills, tiles, concrete mixing",2025-06-22
1319,SteelWorks Inc.,"pipe fitting, electrician, electric systems, construction, plumbing",2025-06-05
1320,ConcreteMasters,"project management, circuit design, leadership, maintenance",2025-06-16
1321,PowerLine Engineers,"finishing, drywall, water systems, HV lines, reinforcement",2025-07-15
1322,FixItAll,"plumbing, green building, inspection",2025-06-01
1323,SafeElectro,"carpentry, insulation, fabrication, pipe fitting",2025-07-09
1324,MegaConstruct,"welding, finishing, design",2025-07-18
1325,BuildRight Co.,"solar panels, masonry, safety protocols",2025-06-27
1326,UrbanGrid Energy,"blueprint reading, pipe fitting, carpentry, solar panels, pouring",2025-06-06
1327,PowerLine Engineers,"tiles, plumbing, inspection, maintenance",2025-06-03
1328,TilePro Solutions,"circuits, safety protocols, leadership",2025-06-20
1329,GreenBuild Tech,"welding, circuit design, budgeting",2025-07-01
1330,PowerLine Engineers,"circuit design, HV lines, budgeting, testing, waterproofing",2025-07-26
1331,FixItAll,"pouring, welding, installation, energy efficiency",2025-07-22
1332,SteelWorks Inc.,"safety, concrete mixing, plumbing",2025-07-02
1333,MegaConstruct,"construction, drywall, waterproofing, reinforcement",2025-07-11
1334,UrbanGrid Energy,"pouring, water systems, waterproofing, project management",2025-06-13
1335,PlumbWell Services,"safety, leadership, energy efficiency, concrete mixing",2025-06-13
1336,QuickBuild,"construction, masonry, solar panels, tiles",2025-07-12
1337,ConcreteMasters,"repair, waterproofing, carpentry, HV lines, circuit design",2025-07-07
1338,FreshCo Homes,"tools, testing, repair, welding, tiles",2025-06-17
1339,ABC Constructions,"installation, insulation, blueprint reading, concrete mixing",2025-06-10
1340,BuildRight Co.,"repair, circuits, energy efficiency",2025-07-11
1341,QuickBuild,"green building, reinforcement, pipe fitting",2025-07-03
1342,PowerFix Ltd,"pouring, pipe fitting, safety protocols, testing",2025-06-13
1343,SteelWorks Inc.,"masonry, pipe fitting, waterproofing",2025-07-16
1344,GreenBuild Tech,"pipe fitting, green building, electrician, safety, testing",2025-07-10
1345,PowerFix Ltd,"energy efficiency, solar panels, insulation, tiles",2025-06-06
1346,SafeElectro,"repair, pouring, maintenance, budgeting",2025-06-11
1347,GreenBuild Tech,"pouring, electrician, circuits",2025-07-22
1348,QuickBuild,"carpentry, construction, leadership, pipe fitting, metal cutting",2025-07-29
1349,QuickBuild,"electric systems, reinforcement, plumbing",2025-06-23
1350,QuickBuild,"inspection, electrician, testing, pipe fitting",2025-06-30
1351,GreenBuild Tech,"waterproofing, water systems, safety protocols",2025-06-22
1352,FixItAll,"tools, insulation, circuit design, concrete mixing",2025-07-21
1353,PowerLine Engineers,"repair, concrete mixing, reinforcement, project management, electric systems",2025-07-13
1354,SafeElectro,"repair, welding, tools, masonry, carpentry",2025-06-13
1355,UrbanGrid Energy,"installation, fabrication, solar panels, multi-trade skills, inspection",2025-07-16
1356,PlumbWell Services,"circuit design, circuits, waterproofing, safety",2025-07-26
