id,name,required_skills,posted
728,SteelWorks Inc.,"reinforcement, leadership, budgeting, safety, fabrication",2025-07-19
729,PlumbWell Services,"design, HV lines, plumbing, tiles, framing",2025-07-28
730,PowerLine Engineers,"insulation, finishing, electrician, water systems",2025-06-16
731,FreshCo Homes,"fabrication, blueprint reading, framing, electrician, masonry",2025-07-15
732,ABC Constructions,"electrician, drywall, HV lines, project management, pipe fitting",2025-07-25
733,GreenBuild Tech,"tools, reinforcement, electric systems",2025-07-16
734,PowerFix Ltd,"energy efficiency, framing, pouring, maintenance, electric systems",2025-06-08
735,SteelWorks Inc.,"electrician, green building, drywall, water systems, inspection",2025-07-23
736,TilePro Solutions,"maintenance, framing, reinforcement, pouring, inspection",2025-07-21
737,FixItAll,"construction, waterproofing, blueprint reading, budgeting, carpentry",2025-06-23
738,GreenBuild Tech,"leadership, tools, budgeting",2025-06-05
739,QuickBuild,"repair, budgeting, project management",2025-06-19
740,FreshCo Homes,"fabrication, electric systems, project management, circuit design",2025-06-25
741,PowerLine Engineers,"safety protocols, inspection, pouring, circuits, welding",2025-06-07
742,SteelWorks Inc.,"circuit design, budgeting, reinforcement",2025-06-04
743,SafeElectro,"construction, masonry, budgeting, testing",2025-06-19
744,MegaConstruct,"electric systems, fabrication, testing, repair, carpentry",2025-07-03
745,MegaConstruct,"inspection, insulation, masonry, pouring, carpentry",2025-07-10
746,ConcreteMasters,"circuits, waterproofing, finishing",2025-06-27
747,SteelWorks Inc.,"masonry, installation, maintenance, blueprint reading",2025-06-25
748,PowerLine Engineers,"inspection, safety, waterproofing",2025-06-03
749,BuildRight Co.,"tools, circuit design, safety, framing, finishing",2025-06-01
750,FreshCo Homes,"masonry, construction, welding, carpentry",2025-07-29
751,QuickBuild,"reinforcement, water systems, leadership, HV lines",2025-06-08
752,PlumbWell Services,"plumbing, metal cutting, electric systems, drywall, installation",2025-06-17
753,PowerFix Ltd,"multi-trade skills, repair, installation, budgeting",2025-07-07
754,FixItAll,"electrician, multi-trade skills, repair, solar panels",2025-06-18
755,SafeElectro,"tools, circuit design, electric systems, drywall, carpentry",2025-06-07
756,PlumbWell Services,"solar panels, circuit design, finishing",2025-06-21
757,UrbanGrid Energy,"construction, welding, reinforcement, energy efficiency, electrician",2025-07-27
758,FreshCo Homes,"blueprint reading, fabrication, solar panels, finishing, waterproofing",2025-06-04
759,SafeElectro,"HV lines, inspection, masonry, framing, green building",2025-06-05
760,ABC Constructions,"welding, installation, construction",2025-06-24
761,BuildRight Co.,"testing, waterproofing, water systems",2025-07-16
762,SteelWorks Inc.,"finishing, testing, leadership, pipe fitting, carpentry",2025-07-13
763,MegaConstruct,"multi-trade skills, tools, welding, insulation",2025-07-08
764,GreenBuild Tech,"maintenance, drywall, project management, reinforcement, insulation",2025-06-03
765,SafeElectro,"metal cutting, framing, circuits, solar panels, repair",2025-07-26
766,FixItAll,"finishing, water systems, framing, design",2025-06-08
767,ConcreteMasters,"project management, electrician, inspection, installation, budgeting",2025-06-15
768,MegaConstruct,"repair, insulation, budgeting, pouring",2025-07-07
769,PowerLine Engineers,"leadership, pouring, multi-trade skills, blueprint reading",2025-07-05
770,FreshCo Homes,"construction, finishing, repair, testing, fabrication",2025-06-01
771,UrbanGrid Energy,"design, tiles, reinforcement, framing",2025-06-06
772,TilePro Solutions,"circuit design, safety protocols, energy efficiency",2025-07-15
773,FixItAll,"leadership, electrician, multi-trade skills",2025-06-04
774,SafeElectro,"pipe fitting, tools, welding, tiles, metal cutting",2025-07-07
775,PowerFix Ltd,"electrician, finishing, installation",2025-07-05
776,GreenBuild Tech,"masonry, leadership, metal cutting, HV lines, fabrication",2025-07-17
777,PlumbWell Services,"design, water systems, project management, electrician",2025-06-04
778,QuickBuild,"carpentry, blueprint reading, multi-trade skills",2025-06-13
779,MegaConstruct,"construction, blueprint reading, electric systems, circuit design",2025-06-18
780,PlumbWell Services,"plumbing, solar panels, fabrication, maintenance, carpentry",2025-06-05
781,SteelWorks Inc.,"design, energy efficiency, framing, safety, finishing",2025-07-02
782,ABC Constructions,"insulation, multi-trade skills, electrician, waterproofing",2025-06-05
783,UrbanGrid Energy,"electrician, circuit design, waterproofing",2025-06-17
784,FixItAll,"maintenance, blueprint reading, budgeting, plumbing, drywall",2025-06-27
785,BuildRight Co.,"tools, reinforcement, circuits, testing, green building",2025-07-17
786,PlumbWell Services,"tiles, project management, energy efficiency",2025-06-19
787,PowerLine Engineers,"pouring, circuits, finishing",2025-06-04
788,SafeElectro,"repair, blueprint reading, project management",2025-07-03
789,SteelWorks Inc.,"solar panels, carpentry, waterproofing, budgeting, inspection",2025-06-26
790,ConcreteMasters,"tiles, pipe fitting, inspection, concrete mixing",2025-07-09
791,GreenBuild Tech,"multi-trade skills, installation, safety",2025-06-23
792,GreenBuild Tech,"electric systems, circuits, pipe fitting",2025-07-23
793,TilePro Solutions,"energy efficiency, design, testing, multi-trade skills",2025-07-04
794,FreshCo Homes,"finishing, electric systems, budgeting",2025-06-29
795,GreenBuild Tech,"welding, pipe fitting, safety protocols",2025-07-15
796,PowerLine Engineers,"project management, electrician, framing, solar panels, pipe fitting",2025-06-22
797,FreshCo Homes,"circuit design, tools, welding, maintenance, concrete mixing",2025-07-23
798,PlumbWell Services,"project management, pouring, carpentry, construction, inspection",2025-07-24
799,MegaConstruct,"maintenance, safety protocols, energy efficiency, pouring, testing",2025-07-30
800,SafeElectro,"plumbing, maintenance, drywall, blueprint reading",2025-06-30
801,ConcreteMasters,"framing, design, reinforcement, electric systems",2025-07-24
802,PowerLine Engineers,"waterproofing, circuits, installation",2025-06-01
803,ConcreteMasters,"safety, circuits, installation, green building, electric systems",2025-07-24
804,PowerFix Ltd,"safety protocols, inspection, project management, safety",2025-07-19
805,ABC Constructions,"multi-trade skills, testing, safety protocols, maintenance",2025-06-04
806,QuickBuild,"metal cutting, waterproofing, tools",2025-07-18
807,GreenBuild Tech,"circuits, safety protocols, drywall, project management, masonry",2025-07-27
808,PowerFix Ltd,"green building, installation, tools, energy efficiency",2025-07-05
809,FreshCo Homes,"leadership, budgeting, masonry, reinforcement",2025-06-27
810,MegaConstruct,"project management, installation, water systems, electric systems",2025-07-06
811,GreenBuild Tech,"design, installation, solar panels",2025-07-25
812,PlumbWell Services,"waterproofing, finishing, reinforcement, installation",2025-07-07
813,SteelWorks Inc.,"waterproofing, solar panels, HV lines",2025-06-24
814,ConcreteMasters,"fabrication, green building, testing",2025-07-11
815,UrbanGrid Energy,"masonry, drywall, pipe fitting",2025-07-23
816,BuildRight Co.,"solar panels, framing, electric systems",2025-07-21
817,SteelWorks Inc.,"water systems, electrician, circuit design",2025-07-28
818,SafeElectro,"safety, masonry, testing, insulation",2025-07-20
819,FixItAll,"safety, electrician, circuit design, testing, budgeting",2025-07-31
820,SteelWorks Inc.,"construction, leadership, HV lines, insulation, circuits",2025-07-31
821,BuildRight Co.,"drywall, tools, safety protocols, leadership, concrete mixing",2025-06-06
822,PowerFix Ltd,"welding, solar panels, pipe fitting, plumbing, safety",2025-07-20
823,PowerFix Ltd,"tiles, circuits, construction, fabrication, pipe fitting",2025-06-24
824,PowerLine Engineers,"finishing, leadership, testing, budgeting",2025-06-10
825,PowerFix Ltd,"waterproofing, plumbing, finishing, construction",2025-07-13
826,TilePro Solutions,"concrete mixing, metal cutting, green building",2025-07-01
827,UrbanGrid Energy,"plumbing, pipe fitting, budgeting",2025-06-23
828,MegaConstruct,"multi-trade skills, testing, budgeting",2025-06-28
829,ABC Constructions,"carpentry, solar panels, energy efficiency",2025-07-20
830,PlumbWell Services,"circuits, electrician, project management, waterproofing, drywall",2025-07-31
831,SafeElectro,"safety protocols, pouring, concrete mixing, finishing",2025-07-07
832,QuickBuild,"green building, concrete mixing, electrician, fabrication, finishing",2025-06-27
833,PowerFix Ltd,"circuits, pipe fitting, green building",2025-06-06
834,PowerLine Engineers,"solar panels, drywall, framing, pipe fitting, carpentry",2025-07-07
835,PowerFix Ltd,"construction, concrete mixing, HV lines",2025-07-01
836,QuickBuild,"budgeting, carpentry, HV lines, waterproofing, project management",2025-07-29
837,FixItAll,"energy efficiency, tiles, plumbing",2025-07-03
838,GreenBuild Tech,"drywall, fabrication, reinforcement, finishing",2025-06-14
839,PlumbWell Services,"water systems, repair, budgeting",2025-06-17
840,FreshCo Homes,"waterproofing, circuit design, blueprint reading, design",2025-07-03
841,FreshCo Homes,"HV lines, repair, blueprint reading, multi-trade skills, maintenance",2025-06-18
842,ABC Constructions,"waterproofing, maintenance, framing, leadership",2025-06-12
843,FixItAll,"safety, multi-trade skills, plumbing",2025-06-24
844,FreshCo Homes,"tools, multi-trade skills, repair",2025-07-12
845,MegaConstruct,"waterproofing, plumbing, circuits, insulation",2025-07-01
846,FreshCo Homes,"metal cutting, tiles, repair, circuit design",2025-07-06
847,PowerFix Ltd,"multi-trade skills, finishing, masonry, drywall, HV lines",2025-06-15
848,ABC Constructions,"inspection, project management, fabrication",2025-07-13
849,SteelWorks Inc.,"metal cutting, installation, circuit design, pipe fitting",2025-07-03
850,FreshCo Homes,"multi-trade skills, tiles, carpentry, circuit design, blueprint reading",2025-07-31
851,ConcreteMasters,"carpentry, circuits, fabrication, blueprint reading, installation",2025-07-10
852,QuickBuild,"drywall, circuits, concrete mixing",2025-06-05
853,FreshCo Homes,"design, masonry, blueprint reading, HV lines, circuits",2025-06-26
854,ABC Constructions,"construction, safety, safety protocols, fabrication, drywall",2025-07-08
855,FixItAll,"blueprint reading, pouring, waterproofing, circuits",2025-07-31
856,FreshCo Homes,"circuits, circuit design, plumbing, design",2025-06-09
857,QuickBuild,"design, framing, insulation",2025-07-15
858,PlumbWell Services,"pipe fitting, multi-trade skills, concrete mixing",2025-06-12
859,TilePro Solutions,"circuits, safety protocols, masonry, construction",2025-07-04
860,FixItAll,"tools, masonry, testing",2025-06-19
861,ConcreteMasters,"design, blueprint reading, testing",2025-07-02
862,PowerLine Engineers,"HV lines, pipe fitting, waterproofing, welding, safety",2025-07-10
863,TilePro Solutions,"pipe fitting, framing, fabrication, safety, reinforcement",2025-07-11
864,BuildRight Co.,"green building, energy efficiency, maintenance, water systems, repair",2025-07-02
865,MegaConstruct,"insulation, leadership, solar panels, metal cutting, HV lines",2025-06-22
866,UrbanGrid Energy,"fabrication, project management, tiles, pipe fitting",2025-07-21
867,FreshCo Homes,"waterproofing, carpentry, inspection",2025-06-14
868,PlumbWell Services,"energy efficiency, circuit design, multi-trade skills, green building",2025-07-16
869,MegaConstruct,"concrete mixing, drywall, tiles, design, welding",2025-07-22
870,SteelWorks Inc.,"electric systems, blueprint reading, framing, metal cutting, plumbing",2025-07-22
871,PlumbWell Services,"project management, design, solar panels, welding",2025-07-26
872,SafeElectro,"fabrication, insulation, testing, construction",2025-07-20
873,PowerLine Engineers,"construction, concrete mixing, fabrication",2025-06-26
874,SafeElectro,"solar panels, water systems, safety",2025-07-20
875,QuickBuild,"repair, multi-trade skills, finishing",2025-06-04
876,ConcreteMasters,"framing, concrete mixing, energy efficiency",2025-07-07
877,PowerFix Ltd,"carpentry, tools, multi-trade skills, leadership, circuits",2025-07-23
878,QuickBuild,"blueprint reading, reinforcement, pipe fitting, fabrication",2025-06-20
879,PowerLine Engineers,"circuits, concrete mixing, solar panels, HV lines, framing",2025-07-31
880,MegaConstruct,"welding, multi-trade skills, pipe fitting",2025-06-21
881,PlumbWell Services,"drywall, tiles, reinforcement, carpentry, fabrication",2025-07-19
882,TilePro Solutions,"pipe fitting, energy efficiency, insulation, installation",2025-06-17
883,TilePro Solutions,"inspection, tools, waterproofing, drywall, electrician",2025-07-12
884,SteelWorks Inc.,"plumbing, insulation, maintenance, welding",2025-07-25
885,ConcreteMasters,"testing, electric systems, water systems, fabrication",2025-06-02
886,QuickBuild,"inspection, finishing, reinforcement",2025-07-30
887,FixItAll,"water systems, maintenance, blueprint reading, electric systems",2025-07-18
888,ABC Constructions,"testing, safety protocols, design, repair",2025-06-11
889,TilePro Solutions,"budgeting, tools, welding, HV lines",2025-07-05
890,QuickBuild,"electrician, inspection, water systems",2025-07-24
891,MegaConstruct,"maintenance, insulation, pipe fitting, circuit design",2025-07-13
892,PowerLine Engineers,"insulation, waterproofing, fabrication, plumbing, tiles",2025-07-26
893,QuickBuild,"pipe fitting, multi-trade skills, pouring, blueprint reading, framing",2025-07-22
894,MegaConstruct,"plumbing, waterproofing, metal cutting",2025-07-19
895,SafeElectro,"leadership, waterproofing, solar panels, carpentry",2025-07-16
896,PlumbWell Services,"finishing, green building, tools, pipe fitting, drywall",2025-07-05
897,FreshCo Homes,"electric systems, safety, drywall, installation, framing",2025-06-14
898,UrbanGrid Energy,"HV lines, masonry, construction, testing",2025-07-07
899,SafeElectro,"energy efficiency, welding, blueprint reading",2025-07-11
900,ABC Constructions,"blueprint reading, budgeting, waterproofing, finishing, green building",2025-07-25
901,TilePro Solutions,"tools, plumbing, blueprint reading, maintenance, leadership",2025-07-10
902,MegaConstruct,"pipe fitting, drywall, inspection, HV lines",2025-06-22
903,ConcreteMasters,"concrete mixing, project management, design",2025-06-19
904,FreshCo Homes,"plumbing, safety, construction, fabrication",2025-07-10
905,SteelWorks Inc.,"tools, energy efficiency, circuit design, circuits",2025-06-25
906,GreenBuild Tech,"concrete mixing, fabrication, budgeting, safety protocols, multi-trade skills",2025-07-10
907,ABC Constructions,"solar panels, concrete mixing, project management, green building",2025-06-21
908,FixItAll,"leadership, plumbing, tiles, blueprint reading, fabrication",2025-07-12
909,GreenBuild Tech,"drywall, welding, framing",2025-07-24
910,PowerLine Engineers,"reinforcement, blueprint reading, concrete mixing, water systems, fabrication",2025-07-06
911,FreshCo Homes,"masonry, insulation, pipe fitting, waterproofing",2025-06-22
912,ABC Constructions,"circuits, design, blueprint reading",2025-06-14
913,PowerLine Engineers,"insulation, reinforcement, budgeting, drywall, fabrication",2025-06-16
914,ABC Constructions,"pouring, safety protocols, green building, fabrication",2025-07-27
915,PowerFix Ltd,"construction, reinforcement, pouring, pipe fitting, metal cutting",2025-06-16
916,ConcreteMasters,"maintenance, HV lines, framing",2025-06-04
917,ABC Constructions,"concrete mixing, framing, circuit design, finishing",2025-07-29
918,GreenBuild Tech,"waterproofing, leadership, electric systems, energy efficiency",2025-07-29
919,FixItAll,"installation, repair, metal cutting, multi-trade skills, safety protocols",2025-06-06
920,FixItAll,"pouring, circuit design, welding, solar panels, repair",2025-06-10
921,FreshCo Homes,"safety protocols, inspection, safety, pouring, blueprint reading",2025-06-04
922,UrbanGrid Energy,"energy efficiency, safety, electrician, waterproofing",2025-07-18
923,MegaConstruct,"water systems, drywall, plumbing",2025-07-26
924,PowerLine Engineers,"inspection, carpentry, insulation, green building, water systems",2025-06-03
925,PlumbWell Services,"energy efficiency, plumbing, drywall, welding, metal cutting",2025-07-24
926,BuildRight Co.,"framing, electric systems, installation",2025-06-02
927,PowerFix Ltd,"concrete mixing, design, testing",2025-06-08
928,PowerLine Engineers,"project management, fabrication, welding",2025-06-28
929,BuildRight Co.,"repair, leadership, drywall",2025-07-29
930,TilePro Solutions,"electrician, plumbing, carpentry, green building, electric systems",2025-07-26
931,UrbanGrid Energy,"tiles, safety protocols, electric systems, waterproofing",2025-07-03
932,SafeElectro,"testing, insulation, blueprint reading, HV lines, inspection",2025-06-24
933,QuickBuild,"concrete mixing, reinforcement, green building, safety, inspection",2025-06-05
934,ABC Constructions,"electric systems, electrician, insulation",2025-07-06
935,SafeElectro,"safety protocols, fabrication, plumbing, blueprint reading, reinforcement",2025-06-26
936,PowerFix Ltd,"water systems, insulation, project management, testing",2025-07-02
937,GreenBuild Tech,"waterproofing, water systems, framing, pouring, testing",2025-06-09
938,SafeElectro,"construction, HV lines, circuits, design, testing",2025-07-07
939,GreenBuild Tech,"installation, design, framing, water systems, circuit design",2025-07-08
940,PlumbWell Services,"installation, insulation, pipe fitting",2025-07-22
941,SafeElectro,"blueprint reading, inspection, testing",2025-06-24
942,PlumbWell Services,"tiles, metal cutting, maintenance",2025-06-04
943,ConcreteMasters,"budgeting, safety, reinforcement",2025-06-06
944,BuildRight Co.,"testing, budgeting, pipe fitting",2025-07-16
945,PowerLine Engineers,"plumbing, construction, circuits, leadership",2025-06-20
946,QuickBuild,"HV lines, reinforcement, maintenance, finishing, design",2025-06-21
947,PowerLine Engineers,"construction, energy efficiency, HV lines, leadership, safety protocols",2025-07-11
948,FixItAll,"water systems, testing, pouring, repair",2025-06-30
949,PlumbWell Services,"welding, construction, circuits, leadership, pipe fitting",2025-07-24
950,ConcreteMasters,"concrete mixing, electrician, metal cutting, safety, carpentry",2025-07-30
951,PowerLine Engineers,"finishing, blueprint reading, leadership, energy efficiency",2025-07-13
952,ABC Constructions,"green building, electrician, maintenance, project management",2025-07-18
953,SteelWorks Inc.,"tools, metal cutting, installation, budgeting",2025-07-11
954,SafeElectro,"blueprint reading, insulation, tiles, masonry, safety",2025-06-13
955,ConcreteMasters,"water systems, plumbing, testing",2025-06-12
956,UrbanGrid Energy,"circuits, electric systems, leadership, carpentry, solar panels",2025-07-24
957,SafeElectro,"insulation, tools, electrician",2025-06-04
958,TilePro Solutions,"masonry, construction, tools, framing, circuit design",2025-07-30
959,SafeElectro,"budgeting, green building, circuit design, waterproofing, reinforcement",2025-06-28
960,FixItAll,"project management, waterproofing, masonry, welding",2025-07-09
961,QuickBuild,"safety protocols, finishing, metal cutting, green building, maintenance",2025-06-09
962,MegaConstruct,"construction, water systems, framing",2025-07-09
963,FixItAll,"design, project management, solar panels, construction",2025-07-06
964,SteelWorks Inc.,"project management, carpentry, waterproofing",2025-07-25
965,GreenBuild Tech,"metal cutting, solar panels, blueprint reading, pouring, testing",2025-07-10
966,SteelWorks Inc.,"installation, green building, construction, finishing",2025-06-03
967,FixItAll,"testing, electric systems, electrician, drywall",2025-07-17
968,ConcreteMasters,"reinforcement, installation, plumbing",2025-06-09
969,PowerLine Engineers,"electric systems, maintenance, project management",2025-07-24
970,UrbanGrid Energy,"water systems, HV lines, circuit design, insulation",2025-06-23
971,MegaConstruct,"leadership, waterproofing, inspection, finishing, electrician",2025-07-21
972,ConcreteMasters,"drywall, masonry, safety protocols",2025-07-30
973,UrbanGrid Energy,"concrete mixing, carpentry, circuit design",2025-06-24
974,GreenBuild Tech,"water systems, inspection, circuit design, solar panels",2025-07-03
975,SteelWorks Inc.,"carpentry, concrete mixing, reinforcement, inspection",2025-06-20
976,PlumbWell Services,"welding, leadership, green building, tools",2025-06-16
977,FreshCo Homes,"concrete mixing, leadership, insulation, solar panels, pouring",2025-06-20
978,PowerFix Ltd,"budgeting, welding, energy efficiency, HV lines, framing",2025-07-05
979,PowerLine Engineers,"inspection, pouring, blueprint reading, insulation",2025-07-16
980,MegaConstruct,"waterproofing, finishing, concrete mixing, insulation",2025-07-26
981,FixItAll,"construction, leadership, masonry",2025-07-18
982,PowerLine Engineers,"project management, budgeting, insulation, carpentry, finishing",2025-06-07
983,SafeElectro,"electric systems, budgeting, fabrication",2025-06-02
984,FixItAll,"drywall, metal cutting, finishing, testing, water systems",2025-06-16
985,PlumbWell Services,"multi-trade skills, repair, reinforcement, circuits, circuit design",2025-07-02
986,FreshCo Homes,"green building, fabrication, water systems",2025-07-18
987,PlumbWell Services,"plumbing, reinforcement, electrician, electric systems",2025-07-08
988,GreenBuild Tech,"water systems, masonry, electric systems, energy efficiency",2025-06-04
989,TilePro Solutions,"carpentry, repair, green building",2025-06-18
990,MegaConstruct,"electric systems, safety protocols, green building, masonry",2025-07-14
991,ABC Constructions,"masonry, fabrication, leadership, safety",2025-06-24
992,SafeElectro,"budgeting, insulation, safety, carpentry",2025-07-23
993,UrbanGrid Energy,"design, plumbing, fabrication, metal cutting, carpentry",2025-06-02
994,SteelWorks Inc.,"maintenance, fabrication, leadership, electric systems, electrician",2025-07-16
995,SteelWorks Inc.,"solar panels, design, green building",2025-07-28
996,SafeElectro,"project management, tiles, plumbing, electric systems, energy efficiency",2025-07-06
997,SteelWorks Inc.,"inspection, testing, green building, finishing",2025-06-08
998,ConcreteMasters,"welding, water systems, electric systems, framing",2025-07-05
999,ABC Constructions,"installation, fabrication, inspection",2025-07-30
1000,FixItAll,"tools, energy efficiency, leadership, concrete mixing",2025-07-26
1001,PowerFix Ltd,"masonry, finishing, project management, safety protocols",2025-06-01
1002,SteelWorks Inc.,"construction, maintenance, concrete mixing, waterproofing, reinforcement",2025-07-09
1003,FreshCo Homes,"electrician, metal cutting, blueprint reading, pipe fitting",2025-06-11
1004,TilePro Solutions,"installation, carpentry, project management, inspection",2025-06-11
1005,TilePro Solutions,"plumbing, circuits, welding, pipe fitting",2025-06-04
1006,FreshCo Homes,"metal cutting, finishing, maintenance",2025-07-02
1007,GreenBuild Tech,"finishing, safety protocols, welding, HV lines, carpentry",2025-07-22
1008,BuildRight Co.,"multi-trade skills, framing, fabrication",2025-06-23
1009,PlumbWell Services,"plumbing, electrician, design",2025-06-10
1010,GreenBuild Tech,"maintenance, reinforcement, electric systems, multi-trade skills",2025-07-16
1011,UrbanGrid Energy,"electrician, electric systems, metal cutting, blueprint reading, project management",2025-06-12
1012,ABC Constructions,"waterproofing, blueprint reading, repair",2025-06-23
1013,QuickBuild,"multi-trade skills, repair, construction, maintenance",2025-06-07
1014,UrbanGrid Energy,"tiles, circuits, insulation, maintenance",2025-06-13
1015,ConcreteMasters,"safety, maintenance, carpentry",2025-06-28
1016,QuickBuild,"multi-trade skills, insulation, green building, finishing",2025-07-22
1017,UrbanGrid Energy,"multi-trade skills, pipe fitting, inspection",2025-07-18
1018,ConcreteMasters,"design, tiles, blueprint reading, inspection",2025-06-09
1019,QuickBuild,"circuits, maintenance, waterproofing",2025-06-27
1020,FixItAll,"leadership, project management, safety",2025-07-07
1021,GreenBuild Tech,"safety, blueprint reading, finishing, safety protocols",2025-06-17
1022,SafeElectro,"energy efficiency, insulation, concrete mixing, solar panels",2025-07-24
1023,PowerFix Ltd,"safety protocols, leadership, electrician, welding, concrete mixing",2025-07-04
1024,PowerFix Ltd,"maintenance, circuits, pouring, project management",2025-07-17
1025,BuildRight Co.,"welding, HV lines, concrete mixing, framing, circuits",2025-07-22
1026,ConcreteMasters,"electrician, masonry, tools, fabrication",2025-07-26
1027,PowerFix Ltd,"insulation, welding, masonry, water systems, construction",2025-07-22
1028,GreenBuild Tech,"reinforcement, fabrication, safety protocols, repair",2025-06-29
1029,PowerFix Ltd,"green building, concrete mixing, metal cutting, drywall",2025-07-07
1030,PowerLine Engineers,"framing, pipe fitting, electrician, HV lines",2025-07-24
1031,FreshCo Homes,"installation, HV lines, finishing",2025-07-08
1032,TilePro Solutions,"design, blueprint reading, finishing",2025-07-26
1033,UrbanGrid Energy,"finishing, carpentry, circuit design, blueprint reading",2025-06-28
1034,PowerFix Ltd,"pouring, fabrication, carpentry",2025-06-20
1035,ABC Constructions,"reinforcement, budgeting, green building, project management",2025-06-10
1036,MegaConstruct,"reinforcement, electric systems, safety protocols, waterproofing",2025-06-24
1037,PowerLine Engineers,"green building, pipe fitting, electric systems, pouring, construction",2025-07-15
1038,GreenBuild Tech,"safety protocols, project management, plumbing",2025-06-24
