id,name,required_skills,posted
101,PlumbWell Services,"solar panels, circuits, circuit design, safety",2025-07-07
102,PowerLine Engineers,"concrete mixing, solar panels, masonry",2025-07-28
103,TilePro Solutions,"testing, blueprint reading, circuit design, electric systems",2025-07-22
104,SafeElectro,"budgeting, blueprint reading, maintenance, safety, pipe fitting",2025-06-01
105,ABC Constructions,"tools, metal cutting, repair",2025-07-06
106,PowerLine Engineers,"carpentry, framing, solar panels",2025-07-08
107,SteelWorks Inc.,"drywall, plumbing, circuits, tools, design",2025-07-04
108,PowerLine Engineers,"fabrication, multi-trade skills, green building",2025-06-10
109,MegaConstruct,"electric systems, water systems, maintenance, plumbing",2025-06-18
110,PowerLine Engineers,"metal cutting, budgeting, framing",2025-07-17
111,QuickBuild,"pouring, energy efficiency, plumbing, circuit design",2025-06-19
112,BuildRight Co.,"plumbing, energy efficiency, carpentry, masonry, safety protocols",2025-07-28
113,MegaConstruct,"budgeting, insulation, solar panels, maintenance, design",2025-06-19
114,ConcreteMasters,"project management, safety protocols, welding, tiles, safety",2025-07-02
115,UrbanGrid Energy,"metal cutting, construction, testing, safety protocols, framing",2025-06-08
116,PlumbWell Services,"inspection, repair, reinforcement, tiles",2025-07-03
117,FixItAll,"plumbing, HV lines, finishing, waterproofing",2025-07-07
118,FixItAll,"welding, multi-trade skills, reinforcement, tiles",2025-06-24
119,QuickBuild,"pouring, maintenance, circuit design, reinforcement, project management",2025-07-22
120,MegaConstruct,"project management, framing, tools",2025-06-07
121,PowerFix Ltd,"safety protocols, masonry, welding, plumbing, construction",2025-07-01
122,ABC Constructions,"reinforcement, framing, waterproofing",2025-07-15
123,PowerLine Engineers,"reinforcement, safety, green building, carpentry, solar panels",2025-06-19
124,UrbanGrid Energy,"pouring, inspection, insulation, circuit design, framing",2025-06-25
125,QuickBuild,"testing, solar panels, tools, fabrication, construction",2025-07-07
126,PowerFix Ltd,"design, circuit design, drywall, HV lines",2025-07-30
127,FixItAll,"project management, solar panels, installation, reinforcement",2025-06-04
128,QuickBuild,"drywall, tools, multi-trade skills, inspection",2025-06-11
129,SafeElectro,"construction, HV lines, installation, testing",2025-06-07
130,FreshCo Homes,"electrician, testing, tools",2025-06-12
131,PowerFix Ltd,"welding, drywall, blueprint reading",2025-06-17
132,PowerFix Ltd,"carpentry, fabrication, circuit design",2025-07-18
133,UrbanGrid Energy,"electrician, tools, metal cutting, safety",2025-07-17
134,SteelWorks Inc.,"multi-trade skills, energy efficiency, inspection, project management",2025-07-17
135,PlumbWell Services,"welding, construction, installation, green building, reinforcement",2025-07-07
136,SafeElectro,"blueprint reading, maintenance, project management",2025-07-04
137,PlumbWell Services,"carpentry, masonry, electrician, framing",2025-06-06
138,ConcreteMasters,"insulation, design, carpentry",2025-07-21
139,BuildRight Co.,"circuit design, project management, waterproofing, design",2025-06-03
140,BuildRight Co.,"budgeting, welding, inspection, fabrication",2025-07-01
141,SafeElectro,"electric systems, finishing, carpentry",2025-06-10
142,GreenBuild Tech,"blueprint reading, circuits, plumbing",2025-06-13
143,TilePro Solutions,"insulation, electrician, multi-trade skills, pipe fitting, green building",2025-06-14
144,FixItAll,"circuit design, framing, electrician",2025-06-03
145,QuickBuild,"insulation, solar panels, concrete mixing, HV lines",2025-06-16
146,BuildRight Co.,"solar panels, installation, design, HV lines",2025-07-16
147,QuickBuild,"insulation, framing, testing, solar panels, circuits",2025-06-30
148,ABC Constructions,"carpentry, framing, pipe fitting, insulation",2025-07-26
149,GreenBuild Tech,"multi-trade skills, waterproofing, safety protocols, tiles, repair",2025-07-28
150,MegaConstruct,"drywall, budgeting, electrician, fabrication",2025-07-26
151,ConcreteMasters,"safety protocols, framing, electric systems",2025-06-17
152,PowerFix Ltd,"concrete mixing, welding, installation",2025-07-16
153,SafeElectro,"blueprint reading, maintenance, water systems, reinforcement",2025-07-25
154,UrbanGrid Energy,"HV lines, electric systems, water systems, carpentry, blueprint reading",2025-06-02
155,GreenBuild Tech,"fabrication, insulation, repair",2025-07-02
156,QuickBuild,"circuits, tiles, framing, concrete mixing, budgeting",2025-06-14
157,UrbanGrid Energy,"finishing, safety, fabrication",2025-06-04
158,ConcreteMasters,"HV lines, project management, solar panels, budgeting",2025-07-27
159,ABC Constructions,"fabrication, project management, metal cutting, HV lines, masonry",2025-06-16
160,TilePro Solutions,"energy efficiency, waterproofing, blueprint reading, drywall, testing",2025-07-29
161,QuickBuild,"budgeting, multi-trade skills, safety",2025-07-16
162,SafeElectro,"drywall, tiles, inspection",2025-07-23
163,PlumbWell Services,"circuit design, tools, inspection, green building",2025-06-13
164,MegaConstruct,"solar panels, drywall, blueprint reading, tools, HV lines",2025-07-09
165,SafeElectro,"inspection, testing, carpentry, plumbing",2025-07-12
166,FixItAll,"plumbing, tools, repair",2025-07-16
167,ABC Constructions,"solar panels, construction, metal cutting, installation, tiles",2025-06-10
168,PlumbWell Services,"tiles, waterproofing, electric systems, HV lines, leadership",2025-07-19
169,MegaConstruct,"concrete mixing, pipe fitting, inspection, insulation, safety",2025-07-02
170,SteelWorks Inc.,"plumbing, green building, water systems, blueprint reading, reinforcement",2025-07-14
171,MegaConstruct,"tools, drywall, plumbing, maintenance, construction",2025-07-10
172,ConcreteMasters,"welding, circuits, leadership",2025-06-19
173,PowerLine Engineers,"HV lines, carpentry, blueprint reading",2025-06-17
174,UrbanGrid Energy,"solar panels, masonry, tiles, repair, welding",2025-07-03
175,QuickBuild,"energy efficiency, electrician, project management",2025-06-27
176,ABC Constructions,"safety, inspection, masonry, insulation, circuit design",2025-07-20
177,UrbanGrid Energy,"pouring, fabrication, masonry, insulation, design",2025-06-30
178,PowerLine Engineers,"finishing, tools, installation, insulation",2025-07-15
179,MegaConstruct,"maintenance, leadership, waterproofing, design",2025-06-03
180,TilePro Solutions,"fabrication, waterproofing, insulation, repair",2025-06-29
181,QuickBuild,"metal cutting, circuits, leadership, reinforcement, insulation",2025-06-16
182,UrbanGrid Energy,"safety, waterproofing, installation, construction, maintenance",2025-06-16
183,ConcreteMasters,"testing, pipe fitting, electrician, framing",2025-07-03
184,MegaConstruct,"inspection, insulation, HV lines, reinforcement, pipe fitting",2025-06-17
185,TilePro Solutions,"HV lines, metal cutting, finishing, testing",2025-07-13
186,UrbanGrid Energy,"metal cutting, finishing, waterproofing",2025-06-30
187,SteelWorks Inc.,"safety protocols, green building, installation, solar panels",2025-06-13
188,UrbanGrid Energy,"HV lines, circuits, metal cutting, leadership",2025-07-14
189,QuickBuild,"solar panels, waterproofing, blueprint reading, repair",2025-06-29
190,SafeElectro,"framing, repair, metal cutting, construction",2025-06-03
191,FreshCo Homes,"metal cutting, plumbing, installation, carpentry",2025-06-28
192,MegaConstruct,"carpentry, masonry, repair, budgeting",2025-07-05
193,ConcreteMasters,"solar panels, repair, circuits",2025-07-13
194,BuildRight Co.,"design, blueprint reading, testing",2025-06-25
195,UrbanGrid Energy,"waterproofing, leadership, budgeting, circuits",2025-07-06
196,TilePro Solutions,"construction, repair, electric systems, leadership, water systems",2025-06-09
197,PowerFix Ltd,"testing, tiles, electric systems, pouring, construction",2025-07-03
198,PlumbWell Services,"solar panels, tiles, maintenance",2025-06-25
199,UrbanGrid Energy,"installation, solar panels, electric systems",2025-06-16
200,FixItAll,"blueprint reading, circuit design, welding, pipe fitting",2025-06-08
201,SteelWorks Inc.,"installation, project management, testing, concrete mixing, fabrication",2025-07-18
202,ConcreteMasters,"project management, maintenance, multi-trade skills, construction, carpentry",2025-06-16
203,PowerLine Engineers,"reinforcement, fabrication, testing",2025-07-28
204,PowerLine Engineers,"energy efficiency, carpentry, concrete mixing, plumbing",2025-07-30
205,SafeElectro,"waterproofing, leadership, pouring",2025-06-28
206,SafeElectro,"welding, electric systems, blueprint reading, energy efficiency, water systems",2025-06-30
207,ConcreteMasters,"welding, project management, maintenance, budgeting",2025-06-20
208,PowerLine Engineers,"energy efficiency, carpentry, repair",2025-06-11
209,SafeElectro,"drywall, HV lines, masonry, design, budgeting",2025-07-08
210,UrbanGrid Energy,"construction, fabrication, reinforcement",2025-06-07
211,PlumbWell Services,"energy efficiency, tools, waterproofing",2025-06-13
212,GreenBuild Tech,"green building, energy efficiency, design, welding, inspection",2025-07-21
213,MegaConstruct,"maintenance, project management, drywall",2025-07-11
214,BuildRight Co.,"HV lines, project management, drywall, concrete mixing, solar panels",2025-07-14
215,BuildRight Co.,"electric systems, finishing, framing, circuit design",2025-07-17
216,GreenBuild Tech,"installation, tiles, testing, construction, pouring",2025-07-14
217,GreenBuild Tech,"leadership, installation, solar panels, fabrication",2025-07-07
218,PlumbWell Services,"drywall, carpentry, electric systems, blueprint reading, design",2025-07-09
219,GreenBuild Tech,"energy efficiency, metal cutting, concrete mixing, plumbing, green building",2025-07-17
220,SafeElectro,"green building, insulation, metal cutting",2025-06-17
221,FreshCo Homes,"blueprint reading, budgeting, installation, testing, welding",2025-06-16
222,ConcreteMasters,"circuits, finishing, metal cutting, safety",2025-06-12
223,FreshCo Homes,"concrete mixing, waterproofing, energy efficiency, water systems, finishing",2025-07-29
224,ConcreteMasters,"green building, multi-trade skills, pipe fitting, framing",2025-06-15
225,FreshCo Homes,"masonry, drywall, electrician, fabrication, tiles",2025-07-18
226,PowerFix Ltd,"leadership, reinforcement, solar panels",2025-06-12
227,MegaConstruct,"multi-trade skills, waterproofing, tiles, insulation, framing",2025-06-25
228,GreenBuild Tech,"finishing, solar panels, pipe fitting",2025-07-16
229,PlumbWell Services,"safety protocols, insulation, electrician, blueprint reading, plumbing",2025-07-13
230,BuildRight Co.,"project management, safety protocols, circuits, pipe fitting",2025-06-29
231,PlumbWell Services,"electric systems, metal cutting, blueprint reading",2025-06-10
232,UrbanGrid Energy,"multi-trade skills, carpentry, circuit design, reinforcement",2025-07-16
233,SteelWorks Inc.,"project management, water systems, budgeting, circuit design, safety protocols",2025-07-03
234,PowerLine Engineers,"green building, plumbing, fabrication",2025-06-22
235,PowerFix Ltd,"carpentry, multi-trade skills, circuit design, project management",2025-07-16
236,TilePro Solutions,"repair, finishing, framing",2025-06-22
237,PowerFix Ltd,"construction, safety, carpentry",2025-07-26
238,GreenBuild Tech,"project management, maintenance, framing, construction",2025-06-20
239,SafeElectro,"pouring, green building, electric systems, fabrication, plumbing",2025-07-27
240,BuildRight Co.,"safety, metal cutting, inspection",2025-06-29
241,GreenBuild Tech,"pouring, tiles, safety protocols, project management, safety",2025-07-06
242,FixItAll,"circuit design, masonry, green building, finishing, circuits",2025-07-03
243,TilePro Solutions,"safety, pouring, repair, electrician, green building",2025-06-04
244,UrbanGrid Energy,"construction, blueprint reading, project management, repair, electric systems",2025-06-17
245,PlumbWell Services,"plumbing, green building, tiles, drywall, inspection",2025-06-01
246,BuildRight Co.,"pipe fitting, budgeting, testing, construction",2025-06-09
247,SteelWorks Inc.,"reinforcement, safety, installation, welding",2025-07-09
248,BuildRight Co.,"circuit design, water systems, repair, installation, maintenance",2025-06-15
249,SteelWorks Inc.,"fabrication, finishing, electric systems, design, water systems",2025-07-02
250,PlumbWell Services,"solar panels, welding, maintenance",2025-07-04
251,BuildRight Co.,"pouring, leadership, circuit design",2025-06-01
252,GreenBuild Tech,"framing, budgeting, plumbing",2025-07-28
253,PlumbWell Services,"tools, tiles, safety protocols",2025-06-09
254,UrbanGrid Energy,"inspection, circuit design, drywall, plumbing, repair",2025-07-21
255,PowerFix Ltd,"repair, concrete mixing, tools, blueprint reading",2025-07-21
256,GreenBuild Tech,"masonry, metal cutting, maintenance",2025-06-07
257,PowerLine Engineers,"tools, design, HV lines, blueprint reading, concrete mixing",2025-07-10
258,GreenBuild Tech,"insulation, repair, electric systems, design, circuits",2025-07-28
259,SafeElectro,"metal cutting, reinforcement, insulation",2025-07-22
260,BuildRight Co.,"budgeting, pouring, green building, carpentry",2025-07-12
261,PowerFix Ltd,"installation, solar panels, masonry, drywall, testing",2025-07-18
262,TilePro Solutions,"fabrication, safety, project management",2025-07-23
263,PowerLine Engineers,"design, electrician, carpentry",2025-07-15
264,PowerLine Engineers,"tools, inspection, drywall, maintenance",2025-06-18
265,SafeElectro,"tools, carpentry, drywall, reinforcement, tiles",2025-06-10
266,PlumbWell Services,"electrician, green building, pipe fitting, solar panels, tools",2025-06-07
267,PowerLine Engineers,"masonry, blueprint reading, inspection, insulation",2025-07-26
268,TilePro Solutions,"multi-trade skills, electric systems, circuit design, safety protocols",2025-06-08
269,MegaConstruct,"multi-trade skills, leadership, design, fabrication",2025-06-02
270,TilePro Solutions,"carpentry, tools, multi-trade skills, safety protocols, installation",2025-06-01
271,UrbanGrid Energy,"tiles, circuits, multi-trade skills, leadership, installation",2025-07-14
272,SteelWorks Inc.,"installation, budgeting, concrete mixing, circuit design, green building",2025-07-16
273,ABC Constructions,"safety protocols, masonry, finishing, reinforcement",2025-07-27
274,FixItAll,"masonry, repair, water systems, HV lines",2025-06-30
275,SafeElectro,"blueprint reading, maintenance, insulation",2025-07-12
276,SafeElectro,"pipe fitting, reinforcement, testing",2025-06-26
277,FreshCo Homes,"green building, drywall, concrete mixing",2025-07-05
278,UrbanGrid Energy,"welding, tiles, multi-trade skills, drywall, carpentry",2025-06-16
279,MegaConstruct,"leadership, water systems, carpentry, HV lines",2025-06-15
280,PowerLine Engineers,"budgeting, framing, drywall, reinforcement",2025-06-30
281,SteelWorks Inc.,"multi-trade skills, electric systems, waterproofing, drywall",2025-07-25
282,TilePro Solutions,"circuits, fabrication, installation, safety protocols",2025-07-01
283,SteelWorks Inc.,"safety protocols, fabrication, insulation, tools, plumbing",2025-06-09
284,MegaConstruct,"maintenance, multi-trade skills, tools, electric systems, concrete mixing",2025-06-18
285,ABC Constructions,"tools, circuit design, construction, budgeting",2025-07-07
286,PlumbWell Services,"fabrication, construction, reinforcement, HV lines, maintenance",2025-06-10
287,QuickBuild,"tools, solar panels, HV lines, budgeting, plumbing",2025-07-01
288,TilePro Solutions,"solar panels, finishing, inspection",2025-06-03
289,TilePro Solutions,"tiles, masonry, concrete mixing",2025-07-27
290,UrbanGrid Energy,"pipe fitting, concrete mixing, energy efficiency, tiles, waterproofing",2025-07-30
291,PlumbWell Services,"tiles, design, electric systems, circuit design, plumbing",2025-06-15
292,MegaConstruct,"pouring, welding, tools, masonry, safety",2025-07-16
293,FreshCo Homes,"safety protocols, framing, budgeting",2025-07-13
294,ConcreteMasters,"safety protocols, framing, insulation",2025-06-04
295,FreshCo Homes,"tiles, energy efficiency, testing",2025-06-11
296,ABC Constructions,"carpentry, metal cutting, construction",2025-06-17
297,BuildRight Co.,"safety protocols, framing, waterproofing, tools",2025-06-13
298,UrbanGrid Energy,"welding, carpentry, electrician",2025-06-11
299,SteelWorks Inc.,"finishing, construction, design, repair, water systems",2025-07-24
300,PowerLine Engineers,"metal cutting, reinforcement, circuits, construction, plumbing",2025-06-25
301,FixItAll,"safety protocols, fabrication, leadership",2025-06-13
302,BuildRight Co.,"construction, design, concrete mixing, repair",2025-06-20
303,SteelWorks Inc.,"metal cutting, budgeting, reinforcement, testing",2025-07-20
304,UrbanGrid Energy,"concrete mixing, circuit design, electrician",2025-06-28
305,PlumbWell Services,"circuits, electrician, water systems, repair, circuit design",2025-06-25
306,MegaConstruct,"carpentry, metal cutting, electrician",2025-06-02
307,PowerFix Ltd,"installation, electrician, finishing, testing",2025-06-04
308,SafeElectro,"HV lines, safety protocols, repair, drywall",2025-06-16
309,UrbanGrid Energy,"insulation, water systems, pouring, green building, installation",2025-07-29
310,QuickBuild,"maintenance, tools, solar panels, finishing",2025-06-29
311,SteelWorks Inc.,"waterproofing, tiles, blueprint reading",2025-06-15
312,GreenBuild Tech,"design, metal cutting, safety protocols, green building",2025-07-22
313,PlumbWell Services,"green building, circuit design, plumbing, safety",2025-06-11
314,BuildRight Co.,"safety protocols, repair, carpentry, pipe fitting, circuits",2025-07-07
315,SteelWorks Inc.,"masonry, leadership, energy efficiency, framing",2025-06-14
316,PowerLine Engineers,"installation, HV lines, tiles, waterproofing",2025-07-25
317,ConcreteMasters,"carpentry, safety, circuit design, installation, plumbing",2025-06-19
318,BuildRight Co.,"testing, welding, safety protocols, circuit design, circuits",2025-07-05
319,FixItAll,"tiles, insulation, water systems, reinforcement",2025-07-29
320,SafeElectro,"tiles, energy efficiency, maintenance, tools",2025-07-10
321,SafeElectro,"welding, pouring, concrete mixing, reinforcement, circuit design",2025-06-30
322,MegaConstruct,"installation, blueprint reading, leadership, carpentry, construction",2025-07-29
323,GreenBuild Tech,"pouring, framing, blueprint reading",2025-06-14
324,ABC Constructions,"waterproofing, maintenance, finishing, solar panels",2025-07-04
325,MegaConstruct,"water systems, fabrication, electrician, circuits",2025-06-25
326,SafeElectro,"welding, electric systems, multi-trade skills, tools",2025-07-15
327,TilePro Solutions,"budgeting, drywall, electrician, design",2025-07-02
328,ConcreteMasters,"fabrication, metal cutting, solar panels, circuit design, inspection",2025-06-19
329,MegaConstruct,"insulation, leadership, budgeting",2025-06-15
330,FixItAll,"inspection, pouring, maintenance, blueprint reading",2025-07-14
331,ABC Constructions,"metal cutting, installation, tiles, electric systems",2025-06-26
332,QuickBuild,"design, carpentry, masonry",2025-07-16
333,SafeElectro,"installation, electrician, tiles, leadership",2025-07-13
334,FreshCo Homes,"safety, safety protocols, insulation, HV lines",2025-07-20
335,ConcreteMasters,"leadership, pipe fitting, carpentry",2025-07-15
336,SteelWorks Inc.,"electrician, welding, testing, budgeting, tiles",2025-06-20
337,QuickBuild,"drywall, metal cutting, inspection, project management, pipe fitting",2025-07-13
338,UrbanGrid Energy,"insulation, masonry, electrician",2025-06-14
339,GreenBuild Tech,"masonry, metal cutting, inspection, maintenance",2025-06-15
340,QuickBuild,"insulation, fabrication, construction",2025-06-03
341,GreenBuild Tech,"carpentry, construction, insulation",2025-06-19
342,FixItAll,"waterproofing, circuits, leadership",2025-06-06
343,FreshCo Homes,"waterproofing, circuits, repair, welding, fabrication",2025-07-18
344,SteelWorks Inc.,"plumbing, masonry, drywall, reinforcement",2025-07-21
345,TilePro Solutions,"green building, insulation, safety protocols",2025-06-15
346,FixItAll,"circuits, testing, solar panels, project management",2025-07-12
347,FixItAll,"carpentry, installation, leadership",2025-06-25
348,PowerFix Ltd,"inspection, plumbing, safety protocols, electrician, masonry",2025-07-27
349,PowerLine Engineers,"tiles, blueprint reading, design, installation",2025-06-02
350,FixItAll,"blueprint reading, green building, energy efficiency",2025-06-14
351,PlumbWell Services,"insulation, concrete mixing, installation, metal cutting, electrician",2025-06-28
352,ABC Constructions,"tools, blueprint reading, maintenance, drywall, project management",2025-06-08
353,PowerFix Ltd,"solar panels, blueprint reading, insulation, framing, pipe fitting",2025-06-01
354,PowerLine Engineers,"reinforcement, green building, circuit design, insulation, HV lines",2025-06-04
355,TilePro Solutions,"electric systems, blueprint reading, solar panels, budgeting, maintenance",2025-07-13
356,QuickBuild,"waterproofing, carpentry, repair, concrete mixing",2025-06-13
357,UrbanGrid Energy,"plumbing, fabrication, waterproofing, solar panels, tiles",2025-07-11
358,TilePro Solutions,"tools, concrete mixing, carpentry",2025-06-18
359,FreshCo Homes,"carpentry, inspection, finishing, circuit design",2025-06-26
360,FixItAll,"framing, design, welding, testing",2025-06-30
361,FixItAll,"HV lines, energy efficiency, solar panels, repair",2025-07-27
362,BuildRight Co.,"metal cutting, pouring, electrician, tools",2025-07-28
363,PowerLine Engineers,"waterproofing, multi-trade skills, installation, safety protocols",2025-07-02
364,QuickBuild,"safety protocols, design, inspection, water systems, tools",2025-07-11
365,FreshCo Homes,"safety protocols, reinforcement, water systems, metal cutting",2025-06-16
366,PowerFix Ltd,"energy efficiency, maintenance, welding",2025-06-16
367,SteelWorks Inc.,"framing, construction, repair, electrician",2025-06-27
368,UrbanGrid Energy,"energy efficiency, pipe fitting, safety protocols, inspection",2025-07-29
369,GreenBuild Tech,"pouring, tools, green building, safety, pipe fitting",2025-07-07
370,UrbanGrid Energy,"green building, insulation, framing, energy efficiency",2025-06-06
371,PowerLine Engineers,"reinforcement, electrician, construction",2025-06-16
372,FreshCo Homes,"testing, pipe fitting, HV lines",2025-07-03
373,FreshCo Homes,"waterproofing, multi-trade skills, water systems",2025-06-04
374,ConcreteMasters,"safety protocols, green building, metal cutting, budgeting",2025-06-07
375,PlumbWell Services,"leadership, concrete mixing, electric systems",2025-07-06
376,PowerFix Ltd,"framing, fabrication, finishing, budgeting, installation",2025-06-18
377,FixItAll,"installation, pouring, electrician, carpentry",2025-06-08
378,QuickBuild,"tiles, tools, budgeting, inspection, water systems",2025-07-03
379,MegaConstruct,"masonry, inspection, safety",2025-06-03
380,SteelWorks Inc.,"leadership, blueprint reading, project management, testing, safety",2025-07-05
381,ConcreteMasters,"green building, water systems, design, reinforcement, concrete mixing",2025-06-12
382,ConcreteMasters,"framing, insulation, maintenance, metal cutting, welding",2025-06-25
383,QuickBuild,"tiles, circuit design, green building, pouring",2025-06-02
384,ABC Constructions,"water systems, construction, pouring, safety",2025-07-14
385,BuildRight Co.,"energy efficiency, testing, water systems",2025-06-10
386,SafeElectro,"concrete mixing, construction, water systems, tiles",2025-06-18
387,QuickBuild,"framing, multi-trade skills, drywall, concrete mixing, HV lines",2025-07-04
388,PowerFix Ltd,"tools, concrete mixing, plumbing, carpentry, electrician",2025-07-04
389,MegaConstruct,"safety, framing, HV lines",2025-06-05
390,PowerFix Ltd,"pipe fitting, green building, insulation, safety, repair",2025-07-21
391,PowerLine Engineers,"reinforcement, green building, testing, pouring",2025-07-10
392,FixItAll,"project management, design, construction, masonry",2025-06-03
393,ABC Constructions,"circuit design, multi-trade skills, budgeting, fabrication",2025-06-19
394,UrbanGrid Energy,"design, repair, HV lines, blueprint reading, tiles",2025-07-20
395,MegaConstruct,"insulation, pouring, tiles, construction, HV lines",2025-06-27
396,SafeElectro,"pipe fitting, blueprint reading, tiles",2025-06-05
397,FreshCo Homes,"multi-trade skills, energy efficiency, welding, waterproofing",2025-07-26
398,BuildRight Co.,"safety protocols, finishing, waterproofing, masonry, insulation",2025-06-06
399,MegaConstruct,"blueprint reading, HV lines, construction, tiles",2025-06-25
400,FreshCo Homes,"finishing, testing, inspection",2025-07-30
401,PlumbWell Services,"tiles, concrete mixing, testing, plumbing, multi-trade skills",2025-06-21
402,PowerLine Engineers,"masonry, waterproofing, construction",2025-07-19
403,SafeElectro,"masonry, circuit design, budgeting, green building, insulation",2025-07-22
404,MegaConstruct,"inspection, green building, concrete mixing, pipe fitting",2025-07-01
405,ABC Constructions,"repair, pouring, safety protocols, drywall, tiles",2025-06-11
406,TilePro Solutions,"green building, HV lines, inspection, safety protocols, tiles",2025-06-25
407,GreenBuild Tech,"blueprint reading, finishing, masonry, solar panels",2025-06-27
408,FreshCo Homes,"reinforcement, circuit design, solar panels, drywall",2025-06-15
409,GreenBuild Tech,"waterproofing, masonry, tools, reinforcement, electrician",2025-06-30
410,UrbanGrid Energy,"electrician, plumbing, testing, concrete mixing, insulation",2025-06-22
411,UrbanGrid Energy,"waterproofing, energy efficiency, green building, blueprint reading, pipe fitting",2025-06-27
412,PlumbWell Services,"installation, insulation, multi-trade skills",2025-07-12
413,GreenBuild Tech,"carpentry, multi-trade skills, maintenance, installation",2025-06-09
